N,SERVICE_ID,SPECIAL_DELEGATE,SERVICE_ROUTE,Description,Separator,GameMaster,InputMaster,LevelMaster,GraphicsMaster,GameMenu,PlayerMaster,ItemMaster,GameEventMaster
0,START_GAME,START_GAME_DELEGATE,GameMasterClass.StartGameService,Starts game from main menu,,W,-,-,-,X,-,-,-
1,SAVE_GAME,SAVE_GAME_DELEGATE,GameMasterClass.SaveGameService,Saves game at any moment,,W,-,X,-,X,-,-,-
2,LOAD_GAME,LOAD_GAME_DELEGATE,GameMasterClass.LoadGameService,Loads game from any moment,,W,-,-,-,X,-,-,-
3,LOAD_ROOM,LOAD_ROOM_DELEGATE,GameMasterClass.LoadRoomService,Loads a room (for example when crossing a door),,W,-,X,-,-,-,-,-
4,EXIT_GAME,EXIT_GAME_DELEGATE,GameMasterClass.ExitGameService,Exits games to OS,,W,-,-,-,X,-,-,-
5,MODULE_LOADING_COMPLETED,LODING_COMPLETED_DELEGATE,GameMasterClass.LoadingCompletedService,This service is called when whole room has been loaded,,W,X,X,X,X,X,X,X
6,IS_MODULE_LOADED,IS_MODULE_LOADED_DELEGATE,GameMasterClass.IsModuleLoadedService,This service returns a bool which tells if given module has been loaded in Room Loading Process,,W,X,X,X,X,X,X,X
7,ITEM_REGISTER,ITEM_REGISTER_DELEGATE,LevelMasterClass.ItemRegisterService,Registers an item in system,,-,-,W,-,-,X,X,-
8,MONO_REGISTER,MONO_REGISTER_DELEGATE,LevelMasterClass.MonoRegisterService,Registers a player in scene,,-,-,W,-,-,X,-,-
9,DOOR_REGISTER,DOOR_REGISTER_DELEGATE,LevelMasterClass.DoorRegisterService,Registers a door in level,,-,-,W,-,-,-,X,-
10,OBTAIN_SCENARIO_ITEMS,OBTAIN_SCENARIO_ITEMS_DELEGATE,LevelMasterClass.ObtainScenarioItemsService,Obtains dictionary of placed elements in actual Scene,,-,-,W,-,-,-,X,-
11,PLAYER_WAYPOINT_UPDATE,PLAYER_WAYPOINT_UPDATE_DELEGATE,LevelMasterClass.PlayerWaypointUpdateService,Updates actual player waypoint when crossing or stopping on it,,-,-,W,-,-,X,-,-
12,GET_WP_LIST,GET_WP_LIST_DELEGATE,LevelMasterClass.GetWaypointListService,Gets list of waypoints and solutions,,-,-,W,-,-,X,-,-
13,GAME_ELEMENT_HOVER,GAME_ELEMENT_HOVER_DELEGATE,LevelMasterClass.GameElementOverService,Any of Game Elements (Player or Item or Door) will call with essential info,,-,-,W,-,X,-,X,-
14,GET_PLAYER_LIST,GET_PLAYER_LIST_DELEGATE,LevelMasterClass.GetPlayerListService,Gets a list of actual players,,-,-,W,X,-,X,-,-
15,GET_NEAREST_WP,GET_NEAREST_WP_DELEGATE,LevelMasterClass.GetNearestWPService,Gets nearest WP from a given coordinates of level,,-,-,W,-,-,X,X,-
16,IS_EVENT_COMBI_OCCURRED,IS_EVENT_COMBI_OCCURRED_DELEGATE,GameEventMasterClass.IsEventCombiOccurredService,Checks if a combination of events is totally complied (event absence can also be requested),,-,-,X,-,X,X,X,W
17,COMMIT_EVENT,COMMIT_EVENT_DELEGATE,GameEventMasterClass.CommitEventService,Activates/Deactivates an event,,-,-,X,-,X,X,X,W
18,COMMIT_MEMENTO_NOTIF,COMMIT_MEMENTO_NOTIF_DELEGATE,GameMenuClass.CommitMementoNotifService,Tells Memento Manager (Menu) a new memento has been unlocked,,-,-,-,-,W,-,-,X
19,IS_MEMENTO_UNLOCKED,IS_MEMENTO_UNLOCKED_DELEGATE,GameEventMasterClass.IsMementoUnlockedService,Tells if a memento is unlocked,,-,-,-,-,X,-,-,W
20,MEMENTO_PARENT_WATCHED,MEMENTO_PARENT_WATCHED_DELEGATE,GameEventMasterClass.MementoParentWatchedService,If a Memento has been analyzed,,-,-,-,-,X,-,-,W
21,INTERACT_PLAYER,INTERACT_PLAYER_DELEGATE,PlayerMasterClass.InteractPlayerService,Makes player interact with usage data,,-,-,X,-,-,W,-,-
22,UNCHAIN_TO_ITEM,UNCHAIN_TO_ITEM_DELEGATE,ItemMasterClass.UnchainToItemService,Applies an unchain event to an item such as spawn or setsprite,,-,-,-,-,-,-,W,X
23,PLAYER_REACHED_WAYPOINT,PLAYER_REACHED_WAYPOINT_DELEGATE,LevelMasterClass.PlayerReachedWaypointService,Tells LevelMaster that player reached Waypoint to start action in case,,-,-,W,-,-,X,-,-
24,USE_ITEM,USE_ITEM_DELEGATE,ItemMasterClass.UseItemService,Uses an item with something,,-,-,X,-,-,-,W,-
25,CANCEL_PICKABLE_ITEM,CANCEL_PICKABLE_ITEM_DELEGATE,GameMenuClass.CancelPickableItemService,Cancels selected item,,-,-,X,-,W,-,X,-
26,KEY_SUBSCRIPTION,KEY_SUBSCRIPTION_DELEGATE,InputMasterClass.KeySubscriptionService,Subscribe to determined key events to avoid polling,,-,W,-,-,X,-,-,-
27,LOCK_PLAYER,LOCK_PLAYER_DELEGATE,PlayerMasterClass.LockPlayerService,Locks player so it cannot act until an action over it has been done (or removes lock),,-,-,X,-,-,W,-,-
28,CHANGE_GAME_MODE,CHANGE_GAME_MODE_DELEGATE,GameMasterClass.ChangeGameModeService,Asks Game Master to set game mode,,W,-,X,-,X,-,-,-
29,SHOW_DIALOGUE,SHOW_DIALOGUE_DELEGATE,GameMenuClass.ShowDialogueService,Second part of start dialogue. Tells Game Menu to prepare menu elements,,-,-,X,-,W,-,-,-
30,ZOOM_SUBSCRIPTION,ZOOM_SUBSCRIPTION_DELEGATE,GraphicsMasterClass.ZoomSubscriptionService,Subscribe to zoom changes,,-,-,-,W,-,-,X,-
31,LAST_SERVICE,EXIT_GAME_DELEGATE,GameMasterClass.ExitGameService,Last service,,W,-,-,-,-,-,-,-