That has no sense!,¡Eso no tiene sentido!
That has nothing outstanding,No tiene nada del otro mundo
Nothing to tell,Nada que decir
I see no reason for doing that,No veo razón para hacer eso
I don't get it - Too complicated,No lo pillo - Es demasiado complicado
I already thought that,Ya le di una vuelta a aquello
That is a great idea!,Es una genial idea!
This mistery is a hard puzzle to solve,Este misterio es un gran rompecabezas que resolver
Victim is definitely gone! They all claim he was poisoned,La víctima definitivamente ha sucumbido! Todos dicen que ha sido envenenado
